{
  "audit_schema_version": 0,
  "event_id": "1a2b3c4d-4444-4d4d-afaf-dddd00000004",
  "timestamp": "2026-06-10T03:15:30Z",
  "enforcement_point": "gateway",
  "enforcement_runtime": "gateway/1.0",
  "event_type": "access",
  "principal": {
    "auth_sub": "agent:sales-02",
    "claimed_id": "agent:sales-99",
    "identity_mismatch": true,
    "role": "sales_agent",
    "session_id": "d3b8e4a0-5555-4e4e-b0b0-eeee00000005",
    "tenant_id": "acme",
    "transport": "rest"
  },
  "purpose": "customer_contact",
  "operation": "check-access",
  "scope": ["name", "email", "phone"],
  "blocked_fields": ["name", "email", "phone"],
  "allowed_fields": [],
  "decision": "deny",
  "outcome": "blocked",
  "reason_code": "identity_mismatch",
  "policy_id": "acme-sales-agent-v0",
  "correlation_id": "req-20260610-031530-0007",
  "subject_id_hash": "5e884898da28047151d0e56f8dc6292773603d0d6aabbdd62a11ef721d1542d8",
  "region": "ap-northeast-1",
  "jurisdiction": "JP",
  "integrity": {
    "seq": 18421,
    "prev_hash": "a3f5c9e2b8d4f6a1c7e9b2d5f8a3c6e9b2d5f8a1c4e7b0d3f6a9c2e5b8d1f4a7",
    "curr_hash": "b4a6d0f3c9e5a7b2d8f0c3e6a9b4d7f0c3e6a9b2d5f8c1e4b7a0d3f6c9e2b5d8"
  }
}
